Property,sameAs,Description,cardinality,marginality,domainIncludes,expected type,allowed values
name,schema:name,"The name of the organization, team or group",one,required,outbreak:Organization,schema:Text,
alternateName,schema:alternateName,"Alternative names or commonly used abbreviations for the organization, team or group",many,recommended,outbreak:Organization,schema:Text,
affiliation,schema:affiliation,"An overarching consortia, multi-institutional team or group in which the organization/team/group is a member or affiliate",many,recommended,outbreak:Organization,outbreak:Organization,
affiliationStatus,schema:additionalType,"The status of the organization's membership or affiliation in the overarching consortial, multi-institutional team or group (current, past)",one,recommended,outbreak:Organization,schema:Text,"[""current"",""past""]"
members,schema:members,"Members of this organization, team, or group",many,recommended,outbreak:Organization,"[outbreak:Person, outbreak:Organization]",
membershipStatus,schema:additionalType,Status of the members of this organization,one,recommended,outbreak:Organization,schema:Text,"[""current"",""past""]"
relatedTo,schema:relatedTo,A resource which a person played a role,many,optional,outbreak:Organization,"[outbreak:ClinicalTrial, outbreak:Analysis, outbreak:Publication, outbreak:Dataset, outbreak:Protocol, schema:SoftwareApplication, schema:Thing]",
class,schema:addtionalType,"A classification of the organization by a resource. Eg- for ClinicalTrials funders, it's [""U.S. National Institutes of Health"", ""Other U.S. Federal agencies"", ""Industry"", ""All others""]",many,optional,"[outbreak:ClinicalTrial, outbreak:Analysis, outbreak:Publication, outbreak:Dataset, outbreak:Protocol, schema:SoftwareApplication, schema:Thing]",schema:Text,
role,schema:additionalType,The role of an organization in its involvement with a resource,many,optional,"[outbreak:ClinicalTrial, outbreak:Analysis, outbreak:Publication, outbreak:Dataset, outbreak:Protocol, schema:SoftwareApplication, schema:Thing]",schema:Text,"[""current"",""past""]"