Property,sameAs,Description,cardinality,marginality,domainIncludes,expected type,allowed values
studyDesign.studyType,prs:DesignModule: StudyType,"Type of human study, can be subtypes of observational study or clinical studies",many,recommended,outbreak:StudyDesign,schema:Text,"""interventional"", ""observational"", ""cohort"", ""case-control"", ""case-only"", ""case-cross-over"", ""ecologic or community studies"", ""family-based"", and ""other"""
studyDesign.Phase,prs:DesignModule: Phase,Stage or phase of the study in the U.S.,many,optional,outbreak:StudyDesign,schema:Text,"""Early Phase 1"", ""Phase 1"", ""Phase 2"", ""Phase 3"", ""Phase 4"", ""Not Applicable"""
studyDesign.designAllocation,prs:DesignAllocation,The method by which the study participants were allocated into groups,one,recommended,outbreak:StudyDesign,schema:Text,"""randomized"", ""nonrandomized"""
studyDesign.designInterventionModel,prs:DesignInfo: DesignInterventionModel,The general design of the strategy for assigning interventions to participants in a clinical study,one,optional,outbreak:StudyDesign,schema:Text,"""single group assignment"", ""parallel assignment"", ""cross-over assignment"", and factorial assignment"""
studyDesign.designPrimaryPurpose,prs:DesignInfo: DesignPrimaryPurpose,The primary purpose of the study,many,recommended,outbreak:StudyDesign,schema:Text,"""treatment"", ""prevention"", ""diagnostic"", ""supportive care"", ""screening"", ""health services research"", ""basic science"", and other"""
studyDesign.designWhoMasked,prs:DesignMaskingInfo: DesignWhoMaskedList: DesignWhoMasked,The people who not know which participants have been assigned to which interventions.,many,recommended,outbreak:StudyDesign,schema:Text,"""Participant"", ""Investigator"", ""Outcomes Assessor"", ""Care Provider"""